caption,passport_link,comment,vertical,subvertical,category,media,author
No need to search all day for the perfect investment property. We can make that match for you! #RealEstate #NewYork #RealEstateInvestment,https://passport.gds.gdcorp.tools/location/75970/content/2778c04b-dd7d-4fb2-b5a5-cb012e5a0aba,Specifically promoting the customer's focus on investment properties.,Professional Services,Real Estate,Product/Service,https://media.mainstreethub.com/media/41b7c59a-578c-46ac-9a05-b1982ac95a62,Alaina Johnson
"With a lifetime powertrain warranty, you can buy without worrying about what may happen down the line.",https://passport.gds.gdcorp.tools/location/43943/content/5fd82e48-3cef-4060-99be-61cd80ab88c4,Showing great customer knowledge by promoting the specific warranty (powertrain warranty) mentioned in their notes.,Automotive,Auto sales,Product/Service,https://media.mainstreethub.com/media/d269b996-0703-448c-85db-6a6f3266ae47,Jose Rodriguez
"We're your one-stop shop for a clean vehicle, Fort Stockton, and that includes dog hair! Check out our dog washing service after driving through our car wash for the ultimate clean. #CarWash #CleanCars #CarismaCarWash #Carisma #DogWash",https://passport.gds.gdcorp.tools/location/73447/content/95314a50-90a5-49bd-b350-b2c0f0290281,Fun customer voice and great level of detail -- promoting the unique aspect of this car wash (their dog wash services).,Automotive,Car wash,Product/Service,https://media.mainstreethub.com/media/d1ad553a-80ef-4f2e-b5fd-3bf3e848ccce,Emily Tuite
"Whether it's a minor dent, a full replacement, or some assistance with your power windows, our team is proud to be a reliable go-to for all of your auto glass needs, Chula Vista. #tigerautoglass #autoglassrepair #glassrepair #chulavista #chulavistaauto",https://passport.gds.gdcorp.tools/location/51527/content/8ef28ed4-30ed-4a09-b5ae-a518a6c0df9d,Tailoring a stretchier underlying concept with super specific info about the types of services this auto shop provides!,Automotive,Auto glass,Product/Service,https://media.mainstreethub.com/media/b27e6474-0b81-473d-8c75-1be32c2424e1,Cecil Sparkman
"Rebuilding your Chevy is a big investment, so don't just just anybody to provide quality parts -- trust the team at Chevs of the 40's!",https://passport.gds.gdcorp.tools/location/56413/content/7a4af8a3-9caa-4f27-9fe3-48800313a7e5,Totally specific to the types of auto parts this customer carries and why people need them.,Automotive,Auto parts,Product/Service,https://media.mainstreethub.com/media/0a762494-b271-4c83-91b7-e7991347d01d,Corey Cavanaugh
"Staying hydrated is an important way to keep your chiropractic care on track! Not only are the connective tissues in your spine directly affected by your daily water intake, but you lose strength and flexibility in your ligaments when you don't drink enough.",https://passport.gds.gdcorp.tools/location/31343/content/07f68a20-58c8-43fa-8cfb-1b97857473f4,Awesome customer expertise to frame this wellness tip and connect it to the type of services the chiropractor offers.,Health and Wellness,Chiropractic,Educational,https://media.mainstreethub.com/media/c55a61fd-77cc-4ea7-896c-6ebea68f40cb,Emily Holton
"From X-rays to embolization, Valley Imaging Consultants offers a wide range of services to help our patients on their path to wellness. For more information on our treatments, visit our website http://www.viradiology.com/.",https://passport.gds.gdcorp.tools/location/81349/content/4d727afb-09eb-4602-8b21-6680d409f399,"Addressing specific services offered by an x-ray and imaging consultant and framing then in a positive, no-fear way.",Health and Wellness,Medical imaging,Product/Service,https://media.mainstreethub.com/media/a03f970d-04cc-4148-83de-88021a326255,Megan Martinez
"Fuel well, feel well! What's your favorite pre-workout drink? #ElevateNutrition #HerbaLife #wellness #RichmondVA #WeLoveYouRichmond",https://passport.gds.gdcorp.tools/location/80753/content/fd99848b-0ed6-4860-ab92-4da9a3032db9,Simple but effective hook on this fun and relevant audience participation question!,Health and Wellness,Nutrition,Audience Participation,https://media.mainstreethub.com/media/efbf65d4-efbe-4622-975c-3243a1a53247,Esther Seawell
"Bedtime routines help your brain separate the day from the night, clear your mind and body of the day's stresses, and relax into sleep. What is your favorite element of your bedtime routine?",https://passport.gds.gdcorp.tools/location/77985/content/eb72bb7c-c8fb-40d3-9963-7faefd625cf1,"Helpful tip as the hook for this awesome participation question. Such an eye-catching design for the graphic, too!",Health and Wellness,Wellness consultant,Audience Participation,https://media.mainstreethub.com/media/8b23c513-37ca-4f5b-af6c-39ed5baa5b23,Allie Pape
"Learning to be at home in one's body and mind is so important, but that's not always an easy thing to do. We're here to listen and provide you the tools for a more balanced self. Let's talk about it today at (480) 650-4835. #CounselingAndWellness",https://passport.gds.gdcorp.tools/location/81650/content/1a0d5488-bd49-4195-b3cc-22032d0e541d,"Capturing the customer's sincere, supportive voice.",Health and Wellness,Counseling,Product/Service,https://media.mainstreethub.com/media/e94b0004-ba9b-4760-b72a-b92c1b46f2ef,Robert Valenzuela
Life's good when you're staying in Prairie City! When are you taking your vacation this year? #HotelPrairie #PrairieCity #OR #travel #vacation #staycation #amenities #HistoricBuilding #VisitOregon #hospitality #OregonHotel,https://passport.gds.gdcorp.tools/location/36524/content/3ec5c0a0-d0dd-4427-b430-509c8115a009,Super relevant participation question for a hotel.,Hotel,Hotel,Audience Participation,https://media.mainstreethub.com/media/839f58a4-cd9d-4009-8de9-13ac86328b7f,Emily Tuite
"Your cat can't tell you what they're feeling, which is where our experienced veterinarian comes in. She'll run appropriate tests and interpret the results in a simple, straightforward way so you can have a thorough picture of your cat's health.",https://passport.gds.gdcorp.tools/location/55811/content/a10ddd49-2973-4fca-8f66-d45a4b522fa1,Spot-on customer voice and focus for this vet that only works with cats.,Pets,Veterinarian,Product/Service,https://media.mainstreethub.com/media/6b23eeae-750e-4d93-b122-1a6c8ba38e25,Annie Cranford
"We've got just about everything you need to keep your pet happy, healthy, and clean! Stop by today to pick up some goodies or set up a grooming appointment. We can't wait to see you! #EMDodgers #PetSupply #DogFood #Grooming #RutherGlen",https://passport.gds.gdcorp.tools/location/55092/content/ab4435eb-c196-422b-ab10-be20d859aa7f,"Awesome choice of testimonial, and the caption is detailed and complementary without repetition.",Pets,Pet Grooming,Testimonial,https://media.mainstreethub.com/media/c9f86e43-4ce4-4967-9c8b-dd6accf6e66f,Caitlin Smith
Make your next charcuterie board a standout with one of our oils! #OliveOil #OldTownManassas,https://passport.gds.gdcorp.tools/location/81625/content/6f7010b9-3180-42a7-8d5a-2dc3819f3f9d,Simple but relevant suggestion for how to use this customer's gourmet products.,Retail,Olive oil,Product/Service,https://media.mainstreethub.com/media/56249beb-7d5e-4299-ac99-8c49d83aaf94,Noah Ainsworth
"Next time you find yourself in need of marine supplies, construction services, fishing gear, or simply a t-shirt, donâ€™t hesitate to pay us a visit.",https://passport.gds.gdcorp.tools/location/57149/content/f5a54b69-0136-47f9-8a06-a63008381277,Addressing the diverse range of products this supply shop carries.,Retail,Hardware,Product/Service,https://media.mainstreethub.com/media/910cfef2-c1c3-4a85-bbe1-529d6fd70d23,Krisee Nesmith
Helping our community stay mobile is something that we're always proud to do! Need a cane or a crutch? We've got it all here.,https://passport.gds.gdcorp.tools/location/42240/content/af2095f8-573c-4a5a-b10f-99f0e8dfe72f,Capturing the customer's voice and staying positive when addressing their mobility aids.,Retail,Pharmacy,Product/Service,https://media.mainstreethub.com/media/9b6dbbc4-cabe-434d-9c7c-37c835641f7e,Michael Greeson
"Whatever the weather, you can have peace of mind knowing that the equipment and supplies in your truck will stay protected after we install your bed cover. Add this accessory to your vehicle by giving us a call: (863) 293-5555. #TruckAccessories",https://passport.gds.gdcorp.tools/location/54441/content/672c3a1a-0d1a-41ea-8c62-fb4dfc56027b,Awesome way to highlight the value of this truck upgrade.,Automotive,Auto customization,Product/Service,https://media.mainstreethub.com/media/babd6c26-d59d-4d64-82aa-b78f55c7f20a,Zoe Labos
"Whether you're riding around the neighborhood or the race track, you should be doing it in style. Check out our selection of scooters and accessories at Americore SMX! #AmericoreSMX #Hilmar #HilmarCA #Scooter #ScooterShop",https://passport.gds.gdcorp.tools/location/58042/content/c2d6e9fc-87e3-436e-af1f-a4560a1517d2,Appealing to both casual and serious riders.,Retail,Scooter shop,Product/Service,https://media.mainstreethub.com/media/806ee714-6398-4337-955c-b6ac4bef5c17,Alaina Johnson
"What started out as a menu with just eight items all those years ago now features everything from burgers, dogs, and Phillys to specialty sandwiches and shakes -- all of it cooked right when you order it.",https://passport.gds.gdcorp.tools/location/45483/content/f7e5c469-58e9-4df4-b37a-7ac5fde62989,Really telling this restaurant's story!,Restaurant,Burgers,About the Business,https://media.mainstreethub.com/media/afe6519f-da08-4231-89ac-9a8e5d40bf14,Krisee Nesmith
Consider this a sign to enjoy a night out with the boys! End your week with a seaside experience at our unique beach bar.,https://passport.gds.gdcorp.tools/location/81509/content/53dc6f59-e5f2-485b-acc3-b5786044e7da,Really tailoring this end-of-week concept to the specific customer and their location.,Restaurant,Night club,Product/Service,https://media.mainstreethub.com/media/d2e1895a-7401-42a9-b15b-dd213375a3eb,Gabrielle Medina
"The glow up you deserve is right here with us. Whether it's a facial treatment, hair color, Botox, or another service, we can take your beauty to the next level: (812) 334-4444.",https://passport.gds.gdcorp.tools/location/81078/content/e770c87b-b4df-4888-95de-1a1470383e45,Positive and specific description of these cosmetic services!,Spas and Salons,Spa,Product/Service,https://media.mainstreethub.com/media/dba38933-8cbb-4165-b7db-0f6cd9b0f8fb,Tina Demetres
"At #PGElectricalSupply, you'll find all the electrical products and knowledge you need to make your space an even brighter place to live. Be sure to stop by our store this week! #MountVernonElectric #electrical #ElectricalSupply #bulbs #wires #conduits",https://passport.gds.gdcorp.tools/location/59444/content/8ad91bd2-3941-47d7-a7fe-e26c187932e4,Fun wordplay adds some levity while keeping the focus on the customer's electrical services.,Home Services,Electrician,Product/Service,https://media.mainstreethub.com/media/fad455e8-7d90-4f82-80cf-994a6862f548,Andrew Broadous
"If you're looking to enhance your living space, we're here to help. Adding a fence to a beautiful backyard is a wonderful way to make your space feel more like your own.",https://passport.gds.gdcorp.tools/location/52713/content/bcd0b481-ac1c-4fa6-bece-a4d87c67c9ff,A great photo to demonstrate exactly what we're talking about in the caption and the value of this customer's fences.,Home Services,Fences ,Product/Service,https://media.mainstreethub.com/media/f98fc095-61d3-4c9e-8817-a0533bbda964,Joshua Creel 
It's easy to stop and smell the cactus flowers when they're right in your own outdoor space. Call us at (602) 433-1174 to talk landscape design!,https://passport.gds.gdcorp.tools/location/79554/content/fc13591e-b738-4831-8e5e-c9f0234a9e7f,Awesome image-inspired caption that highlights the variety of options this landscaping business offers and how great it would be to have them in your home.,Home Services,Landscaping,Product/Service,https://media.mainstreethub.com/media/eed96bc4-cbf9-4b4f-8119-7e700d2f43da,Maddy Dessanti
"A spare room is great to use as an office, guest bedroom, or even a playroom. How are you taking advantage of any extra space in your home? Let us know in the comments! #Autumnwood",https://passport.gds.gdcorp.tools/location/67612/content/8aa4965f-0f96-4ed5-9269-dce1786009c8,A unique participation question paired with a very cohesive image.,Home Services,Construction ,Audience Participation,https://media.mainstreethub.com/media/2e0a28bb-5573-44c8-ae8d-81adec240cd8,Omar Guzman
"Green is in right now. Depending on the shade you use, this color can help turn your space into a serene sanctuary, vibrant playroom, or a dramatic and moody bedroom. What are your thoughts about using this color around your home?",https://passport.gds.gdcorp.tools/location/69623/content/f2e61563-df67-4cbb-bb22-2e3a3b2bff78,Timely and relevant framing gives this caption a feeling of real industry expertise.,Home Services,Construction ,Audience Participation,https://media.mainstreethub.com/media/e71991d3-0096-439b-9e68-b8ef123e6bd5,Robert Valenzuela
"Our services play an important role in the local ecosystem by planting flowers, trees, and keeping your garden lush. As a full-service business, we'll help you build and maintain your beautiful landscape for your home. #RogerBSturgisAndAssociates #landscaper #landscaping #FullServiceLandscaper #FullServiceLandscaping #tree #TreeServices #plowing #FallCleanups #maintenance #framingham #massachusetts #FraminghamMA #FraminghamMassachusetts",https://passport.gds.gdcorp.tools/location/66192/content/a780086f-e9f4-4530-95d4-1007cc1cc9c5,"Offering great context for how this customer's services play into the broader ecosystem, which the customer emphasizes in their notes.",Home Services,Landscaping,About the Business,https://media.mainstreethub.com/media/ca433ba6-2a20-4b93-91b2-c652ebc3ccdd,Valerie Lancaster
"Hey #AllenTX , we're here with answers to those leaks. Our experience lends us the expertise to get in, get to fixing, and get out.",https://passport.gds.gdcorp.tools/location/82076/content/da8c9c03-72d6-4203-a4cc-acfb0ea65a8f,Fun and confident customer voice in the caption and graphic for this brand kit post.,Home Services,Plumbing,About the Business,https://media.mainstreethub.com/media/a12c5e21-9a5e-4f3e-bdb8-29cf9646cba2,Jake Fuqua
Have you ever read our annual water quality report? Evansville has met all the federal legal guidelines. That's great news -- but we also need to consider that water quality guidelines for tap water haven't been updated for 20 years. Check out our water quality report through the link in our Facebook post along with new suggested guidelines. #BaylorHeatingAndAirConditioning,https://passport.gds.gdcorp.tools/location/80386/content/7d91deb0-d07a-44cb-9ecb-15e05d90e7e7,"Breaking down the importance of a potentially dry, info-heavy resource the customer asked us to share.",Home Services,HVAC,Educational,https://media.mainstreethub.com/media/889ea370-c0be-4daa-93a6-22ce032871a4,Kelsey Blaylock
"Ever hear a gurgling noise around your drains? Gurgling is a sign that your outward bound sewage line is becoming too narrow due to buildup in the pipes. When liquid tries to go through a narrowed pipe, the air is displaced and creates a ""glub glub glubâ€ noise. Time to get the lines cleaned before it turns into a blocked pipe, closed doors, and bad reviews! Call (806) 373-7866.",https://passport.gds.gdcorp.tools/location/78892/content/c3f1463b-3794-4a31-ac5a-b312e9662ad8,A helpful and specific tip framed in a clear and actionable way.,Home Services,Plumbing,Educational,https://media.mainstreethub.com/media/afaae313-1b65-4973-90d8-87bb856215a6,Lauren Smola
"We work hard to deliver results that we both can take pride in! When we're finished, you'll have a property to brag about. #TreeServices #TreeCare",https://passport.gds.gdcorp.tools/location/66824/content/ad38ce17-b474-497e-b8db-cef16fdecddd,"Great choice of testimonial quote, and a complementary caption that doesn't have any direct repetition.",Home Services,Tree Care,Testimonial,https://media.mainstreethub.com/media/565dbabb-e38f-41c6-969c-3e00e2dade5d,Gabrielle Medina
"Whether you're in search of leather seats or four-wheel drive, we'll tackle your wish-list and find you the champion of cars. #BillsAutoTruckSales #BillsAuto #SATX #SATXAuto #UsedCars #UsedTrucks",https://passport.gds.gdcorp.tools/location/68166/content/4eae5eef-431f-4b2e-b6ce-99e2f616d32a,"Matching the customer's competent, informative voice and promoting specific car features without getting overly sales-y.",Automotive,Auto sales,Product/Service,https://media.mainstreethub.com/media/87dc576e-0d8a-4cdd-95cb-f20505e941f8,Kaitlin Morley
"If you're on I-5 and in the market for a new bike, just look for the sign.",https://passport.gds.gdcorp.tools/location/78533/content/6c5b2292-1df1-4626-a9df-53e585bc54d9,Simple but 100% customer-specific thanks to that clever local connection.,Automotive,Motorcycle sales,Product/Service,https://media.mainstreethub.com/media/b3c28d38-c290-4629-9af7-56b4f1d19806,Zoe Labos
We help make your dreams of a waterfront vacation come true. Learn more about what we have available: (989) 362-3300.,https://passport.gds.gdcorp.tools/location/76227/content/934c496e-3d79-4a71-8659-cb1d0c5a56b6,Taking inspiration from the location and photo for a unique post that's sure to inspire some rentals.,Hotel,Vacation rental,Product/Service,https://media.mainstreethub.com/media/4f3a64c4-9133-4564-876a-49b357643192,Jose Rodriguez
"We're firing up the grill! Whether you're in the mood for a burger or a fish basket, we have some delicious options at Charlene's Coyote Grille. ðŸ˜‹ #RoadRunnerTravelResort #FortPierce #FL #florida #RVPark #CabinRentals #vacation #travel #dinner #CharlenesCoyoteGrille",https://passport.gds.gdcorp.tools/location/35761/content/ae7cb35c-6ff2-49f9-a6eb-2ca1eff1af80,Highlighting some specific dishes this resort restaurant serves. The hook also brings a great sense of customer voice.,Hotel,Resort,Product/Service,https://media.mainstreethub.com/media/1d34b2cc-7ecb-40eb-8577-26ee7e8dd4f0,Emily Tuite
"Located on 170 acres in the heart of the beautiful Texas Hill Country, Log Country Cove offers the ultimate getaway experience for families and couples. #BurnetTexas",https://passport.gds.gdcorp.tools/location/41148/content/778e56cb-cbee-49c2-8ade-5ac8698ceb37,Taking every opportunity for tailoring with a creative description of the hotel's location and target audience. ,Hotel,Cabins,About the Business,https://media.mainstreethub.com/media/f79ff5e0-6753-4659-a202-6e90faf63a78,Mae Dolan
"Life out on the ranch is always exciting! When you sign your pup up for overnight boarding, they'll meet our farm animals, walk the nearby trails, and check out local watering holes. Learn more here: https://elitepuptraining.com/overnight-boarding. #SBDogs #DogBoarding #RanchLife",https://passport.gds.gdcorp.tools/location/78158/content/60c200e2-c88d-4ed0-a64d-4a2ae2664138,Promoting some of the truly unique things this dog boarding and training customer has to offer.,Pets,Dog training,About the Business,https://media.mainstreethub.com/media/3cf45ca5-8cba-46d9-81d9-6db7f941ba52,Emily Tuite
"Bring your new baby home without any worries! We thoroughly screen our breeders, and all of our puppies come with up-to-date vaccinations, a health warranty, and a microchip with lifetime enrollment.",https://passport.gds.gdcorp.tools/location/65223/content/e4ae5f51-2548-4343-ac6a-4d78cbaaa3da,Super specific description of the customer's requirements for reputable breeders. The framing is nice and reassuring.,Pets,Dog breeder,About the Business,https://media.mainstreethub.com/media/77c2a4ad-b4a6-44d1-994d-ad9f78b2a898,Annie Cranford
"Accidents and emergencies never seem to stick to a schedule, right? That's why we offer 24-hour service. If your pet is sick or injured, just call us at (715) 257-7003 -- no matter what time it is. #AthenVeterinaryService #AthensWI #AnimalCare #veterinery #AthensAnimalCare",https://passport.gds.gdcorp.tools/location/55399/content/6e324aac-b134-409f-b162-22a26785fa7d,"Clear and reassuring when dealing with a stressful topic, pet emergencies.",Pets,Veterinarian,Product/Service,https://media.mainstreethub.com/media/4427043f-2689-4d27-8351-f259802314f2,Caitlin Smith
Are your orchestra students set up for a successful new year? Get them the instruments they need right here at H & H Music Service!,https://passport.gds.gdcorp.tools/location/68966/content/5e74e089-4b25-491f-adb0-2c55427c50d0,Clearly addressing a timely need that's relevant to the customer: teachers whose students need to rent instruments.,Retail,Music store,Product/Service,https://media.mainstreethub.com/media/82054833-0b44-457b-81cf-e6e5ad82aa74,Jose Rodriguez
"Therapeutic shoes are specially designed shoes, or shoe inserts, intended to reduce the risk of skin breakdown in diabetics with co-existing foot disease.",https://passport.gds.gdcorp.tools/location/81044/content/a0c527a7-2b9f-43c6-80bf-a5383964d033,"Presenting specific customer info in a clear, approachable way with a totally cohesive choice of image.",Retail,Shoe store,Product/Service,https://media.mainstreethub.com/media/f5b4c4ed-da71-4412-b582-b41818251f63,Nancy Gonzalez
"We have great news: These unique and popular soup-and-sandwich plates are back in stock! Perfect for light summer meals or maybe for ice cream and cookies. Yes, that's the perfect way to use these! Stop by to check them out.",https://passport.gds.gdcorp.tools/location/76513/content/d1ac6074-3325-4c36-a74c-c7742c7325c1,This content request has some fun and creative suggestions for how to use the product we're promoting to make things extra engaging.,Retail,Gift shop,Product/Service,https://media.mainstreethub.com/media/6bfd53dd-03d8-4af5-9a00-73702a90cd0f,Lou Ruiz
"From the bulkiest comforters to the lightest delicates, no load is too much for our machines. #Washateria #UpscaleLaundromat",https://passport.gds.gdcorp.tools/location/60054/content/4a555a7b-4e5f-4dbf-a94a-9bd75803f758,A nice use of the from-to range to demonstrate the variety of reasons people might want to visit this laundromat.,Retail,Laundromat,Product/Service,https://media.mainstreethub.com/media/78f12a9c-a762-40bc-ac27-9bc1df479bc3,Noah Ainsworth
"Weâ€™ve been bringing friendly customer service and unique gifts to this community since 1989, and we couldnâ€™t be more proud to be a staple the locals visit time and time again.",https://passport.gds.gdcorp.tools/location/79656/content/6d109145-dff3-450e-8ca8-2c49094f352e,"This post does a nice job establishing the customer as a fixture in their community, and the Scottsdale t-shirt in the image is a nice touch for cohesion.",Retail,Gift shop,About the Business,https://media.mainstreethub.com/media/4d882d10-e29e-48af-a3ec-8543c5df08d4,Krisee Nesmith
"You have the color scheme in mind, but you don't know what flowers would be best for your arrangements. That's where we come in! As your flower experts, we'll help you refine your vision and bring it to life. #FloralArrangements #CustomFlowers",https://passport.gds.gdcorp.tools/location/34656/content/ff8e161f-c37f-4ea3-a3ec-3b5420937e2d,Really telling the story of how this customer helps people.,Retail,Florist,Product/Service,https://media.mainstreethub.com/media/11e01ca8-2636-4e14-bd7f-53c24637b75a,Gabrielle Medina
"If you're not getting the results you want from a curling iron, we have a beautiful alternative. #GrandMartHairStore #wigs #TightCurls #HairStore #PhoenixAZ",https://passport.gds.gdcorp.tools/location/55841/content/2e9ab742-67d9-4cc0-b38f-39d60dd71177,Succinct but clear way to explain why people might want to check out this customer's hair extension options and wigs.,Retail,Hair and wigs,Product/Service,https://media.mainstreethub.com/media/80113498-6e8f-45c8-8737-abd4b6e4a3db,Andrew Broadous
"Sometimes, our kazandibi gets all the attention, but our baklava is a dessert you shouldn't forget about!",https://passport.gds.gdcorp.tools/location/32248/content/ca5aa44a-e194-4f74-84a1-aa537ed6e423,Fun way to promote not one but two different desserts this restaurant serves.,Restaurant,Mediterranean,Product/Service,https://media.mainstreethub.com/media/e66baab2-596c-4684-9809-aad4d3aeb2cb,Nancy Gonzalez
"At Brickyard Cafe, an antique carriage factory turned modern eatery, we've created a fine-dining atmosphere with quaint-town charm.",https://passport.gds.gdcorp.tools/location/58873/content/cca2e833-2e8a-4032-8385-0bb01445603c,A great description of this restaurant's unique space.,Restaurant,Italian,About the Business,https://media.mainstreethub.com/media/5649cfa0-9b9c-4456-a9fb-1c5ad187231b,Krisee Nesmith
"Grandma's pie: packed with shredded mozzarella cheese, homemade zesty pizza sauce, fresh mozzarella & fresh basil, topped with pecorino romano. It doesn't get any better than that!",https://passport.gds.gdcorp.tools/location/63348/content/2d338d42-d437-4dae-b964-0dd04f3f7295,"The description of this pizza is creative, specific, and mouth-watering.",Restaurant,Pizza,Product/Service,https://media.mainstreethub.com/media/39ee73a9-1cf7-48f5-96a1-50bb58ee79b7,Ana Gutierrez
"Think local -- drink local! If you're tired of seeing shelves and shelves of mass-produced spirits at the liquor store, our place is the perfect pit stop for a bottle or two of the good stuff made in the heart of our great state. #DrinkLocal #TexasDistillery #ShireDistilling",https://passport.gds.gdcorp.tools/location/81261/content/b104582e-18e6-486c-923a-af6b33ca6220,Really embodying the customer's voice and pride for their product.,Restaurant,Distillery,Product/Service,https://media.mainstreethub.com/media/17ed915e-8505-4f99-b6cf-da08d6652368,Cecil Sparkman
