caption,passport_link,comment,vertical,subvertical,category,media,author
"Tip: You should fix any loose handles before you host an open house tour. Otherwise, potential buyers might think there are other things that need to be repaired.",https://passport.mainstreethub.com/location/79975/content/6eeebbb7-9290-49dc-87c2-0881b95470dd,"This is a nice example of how you can put a creative twist on a ""getting ready to sell/show your home"" tip.",Professional Services,Real Estate,Educational,https://media.mainstreethub.com/media/68228de3-be9f-4de4-b82e-fb8203cde12a,Kaitlin Morley
"Looking for ways to up your property value? Energy efficiency is a great way! Incorporating environmentally-friendly lighting, windows, doors, and siding installations will save you costs in the long run.",https://passport.mainstreethub.com/location/80488/content/b16f053b-e2dc-40ca-8f36-6b25b229bc7e,A unique and relatively actionable tip for increasing the value of your home (and helping the environment).,Professional Services,Real Estate,Educational,https://media.mainstreethub.com/media/e72c1ab5-d7e2-4dcc-a1ed-e617f941eb33,Manuela Domingos
"As a former mathematics teacher, I take a logical, calculated approach to real estate. Whether you're selling or buying, I'll make sure the numbers all add up to a great experience. #KatieSmith #RealEstate",https://passport.mainstreethub.com/location/68386/content/53cbfcb1-74bd-4a2c-bf2c-9b9f98b26baa,Perfect use of background information about a real estate agent makes this post 100% unique.,Professional Services,Real Estate,About the Business,https://media.mainstreethub.com/media/6b35d0c2-eb17-4bcb-a279-821ccc1dacbc,Andrew Broadous
Are your breaks squeaking or feeling squishy? Stop by our shop -- we'll get you back on the road quickly and safely.,https://passport.mainstreethub.com/location/47773/content/5151e89f-566c-437c-a7d9-3021b6500c5d,Addressing a specific reason people need auto service. Helpful and actionable!,Automotive,Auto Repair,Product/Service,https://media.mainstreethub.com/media/6e760896-d4ba-43f7-bb14-0a1885a7e938,Allison Randel
"Looking to get rid of that hail damage on top of your vehicle? No worries! We may focus on collision work, but we can get that patched up.",https://passport.mainstreethub.com/location/74988/content/a9414e50-578b-447a-8a05-ec90d634c1b6,Clearly promoting a secondary service the customer offers that's seasonally relevant.,Automotive,Auto Repair,Product/Service,https://media.mainstreethub.com/media/9dbba7b1-b2a5-40a8-8725-722dd59d65a7,Derek Koh
Work out smarter -- not harder! Wiemspro EMS provides the results of a 90-minute workout in just one 20-minute session. All sessions are individually supervised by a professional. Call (916) 201-4513 to get started.,https://passport.mainstreethub.com/location/80443/content/745aabc8-aa5a-4f1b-a32d-129cfa689f72,This content request gives a good sense of how the customer wants to frame their health and wellness services (specific advanced tools make it more effective and convenient).,Health and Wellness,Holistic,Product/Service,https://media.mainstreethub.com/media/0b172aa0-46a0-4dfe-a8b6-74a259b11c91,Lou Ruiz
"Take your skincare routine into your own hands! Properly caring for your skin can improve deep wrinkles, hyperpigmentation, acne scarring, and more. Ask us about the right products for you!",https://passport.mainstreethub.com/location/79463/content/18b6c831-7a70-4c72-9962-8fabc80a8e65,"Wordplay and a great image help grab the readers' attention, but we also have awesome detail and consideration of consumer needs!",Health and Wellness,Med Spa,Product/Service,https://media.mainstreethub.com/media/20b1f292-0bf3-4f73-bb91-1d5a818f8ab0,Gabrielle Medina
We're the experts in speed and agility training in the Chicagoland area. Get a step ahead of the competition with our small groups and 1-1 training. #chicagolandfitness #tiptoptraining #tiptopathlete #fitnessmotivation #agilitytraining #chicagoland #speedtraining,https://passport.mainstreethub.com/location/70822/content/3d1083ee-1ef5-471c-af76-005bc447f612,Promoting a unique service with a clear sense of customer voice.,Health and Wellness,Fitness,Product/Service,https://media.mainstreethub.com/media/b1f571b9-08bd-4f63-b5ed-b55b24ae13a6,Brandon Kenning
"With 14 locations across Delmarva, we're here to help our neighbors and community members feel better.",https://passport.mainstreethub.com/location/81023/content/aa6869de-1ab0-4823-9d09-c76e50436e16,A simple way to make things totally customer-specific (naming the area where they're located and using language related to the wellness services they provide).,Health and Wellness,Physical Therapy,About the Business,https://media.mainstreethub.com/media/378f6165-89c2-49e5-a2ea-861f04c73eb6,Alyssa Wright
"We're all about progress, not perfection. It's time to get back on the mat and back to improving! Visit our website to check out our adult-level classes and start practicing: http://www.crystaldragonkarate.com.",https://passport.mainstreethub.com/location/79353/content/8a918506-909c-4cff-8d9c-c2fd11a68dae,Nice customer voice encouraging people to sign up for classes if they may have taken a break during the last few months.,Health and Wellness,Fitness,Product/Service,https://media.mainstreethub.com/media/53c48666-4322-4e34-9761-830a62f16418,Lacey Morris
"It's time you gave yourself the relaxing vacation you deserve! Stroll through our garden or explore downtown San Antonio to reinvigorate your mind, body, and soul. #arborhousesuites",https://passport.mainstreethub.com/location/65338/content/7d9664b3-623c-4298-9f12-f535f15c4127,Bringing in a great local connection while clearly giving people a reason to book their stay at this hotel!,Hotel,Luxury Hotel,Product/Service,https://media.mainstreethub.com/media/2ffe9426-373f-4e11-960b-79162151b4f1,Madison Holloway
"Meals on vacation are so much more than just meals. They're opportunities to recap the day, unwind with family, and recharge for tomorrow. Here at Borrego Springs Resort, there's nothing we take more seriously! The Arches restaurant is open Thursday through Sunday.",https://passport.mainstreethub.com/location/42422/content/0b943d8c-29be-47e7-a41e-6a86543b12c1,Adding a nice degree of customer specificity by tying in the restaurant located at this resort.,Hotel,Resort,Product/Service,https://media.mainstreethub.com/media/c41b63bc-a799-4821-b8f7-b9fa9a56eaca,Caitlin Smith
Avoid periodontal issues in your dog by keeping up with their oral hygiene. Want to know the best way for your pet? Give us a call today!,https://passport.mainstreethub.com/location/57939/content/efe72fd2-d8f0-4335-b380-c9ad449f0051,Strong customer voice makes this a more unique tip than simply reminding people to care for dogs' oral health.,Pets,Vet,Educational,https://media.mainstreethub.com/media/9194dbfd-2f56-452c-831d-9329eb05f7e5,Jose Rodriguez
"If you want to keep your pets free of pests this spring and summer, we can help. Our selection of Advantage products will ensure that they only have fun in the great outdoors this year!",https://passport.mainstreethub.com/location/55092/content/48675dbf-26fb-4022-940c-86c2aab7c38c,Promoting a specific line of products and connecting to a clear seasonal consumer need.,Pets,Pet Store,Product/Service,https://media.mainstreethub.com/media/f0ee35f5-5e60-42c2-bc52-7fce5d9c7802,Caitlin Smith
"Saddle up! When you're looking to adopt a horse, start your search at a rescue and give your horse a new lease on life. http://saddlebredrescue.com #saddlebredrescue #SaveOurSaddlebreds",https://passport.mainstreethub.com/location/72230/content/e9dbc89d-2679-4b74-8b03-38708f990fc0,Awesome level of specificity and customer voice for a truly niche business (horse rescue).,Pets,Animal Rescue,Product/Service,https://media.mainstreethub.com/media/1e0c3f6d-fbde-4bcc-afad-ac5b18292a1a,Laura Chandler
"From custom graphics, signs, and banners to shirt printing, we can do it all. For more information about our services, visit our website: http://cuttingloose.com.",https://passport.mainstreethub.com/location/61888/content/c1ced9f6-9a0c-4f5f-891a-684ff5dfffd4,"It's not always necessary to present the business's full range of services, but once in a while, it's great to remind people that the business offers a wide range of options!",Retail,Printing,Product/Service,https://media.mainstreethub.com/media/d857a5b6-c171-4caf-b870-1801f3d5a904,Emily Holton
"Snow season may be over, but that won't stop us from boarding! Explore our selection of skateboard decks today.",https://passport.mainstreethub.com/location/73002/content/7500cf36-b9a2-4229-9229-33ff4849b222,Keeping things seasonally relevant for this skate shop.,Retail,Athletics,Product/Service,https://media.mainstreethub.com/media/8d90bbfc-a358-467d-8602-d13612514780,Gabrielle Medina
We have standing and bed options for our customers. We always make sure that you'll get the exact tan you're looking for. Ask us about our tanning packages -- (614) 851-5420 !,https://passport.mainstreethub.com/location/48747/content/cee2a924-3229-44fb-8b86-a98c42d05dbd,Getting specific about this customer's tanning services.,Spa and Salon,Tanning,Product/Service,https://media.mainstreethub.com/media/098d6f0e-7a3c-46e9-88cb-2d8b80694cb1,Ian Austin-Michaud
"There's nothing we love more than starting our days with you, Twin Falls! Get your morning cup of joe with us here at Depot Grill. #depotgrill #twinfallsid #twinfalls #comfortfood #since1997",https://passport.mainstreethub.com/location/55313/content/f66215cf-1527-48da-84d8-29b196fd914f,Tying a local love concept back to the specific type of restaurant this is.,Restaurant,American,Product/Service,https://media.mainstreethub.com/media/a93304d9-a287-4604-bbba-ba7eeb94da03,Allison Randel
Need an afternoon pick-me-up? Our Red Bull drinks are refreshing and energizing! #RedBullDrinks #BigScoopCreamery,https://passport.mainstreethub.com/location/40239/content/a69107d1-b35c-4a2c-b964-850ca8fb1d98,Taking inspiration from the photo for an ultra-specific product highlight.,Restaurant,Ice Cream Shop,Product/Service,https://media.mainstreethub.com/media/d0f74f67-29d9-4d0b-914d-fcf1cc6ddcd9,Michaela Donlan
Dig into something delicious this week -- like a bowl of our mourgh challow served with rice.,https://passport.mainstreethub.com/location/28136/content/f1eceaba-ecf6-4911-b290-01f0477da15d,"It's not always possible to get this specific about a restaurant's menu, but when you can, it makes for a super effective product highlight!",Restaurant,Middle Eastern,Product/Service,https://media.mainstreethub.com/media/741c7136-a224-4284-a6d4-9fae6f8e5a3e,Emily Carpenter
"From waxing to brows to lash tinting and lifting, we'll get you taken care of just in time for hot girl summer! Schedule online today: https://square.site/book/9SXVV10MNQT2R/claudette-jean-bay-shore-ny.",https://passport.mainstreethub.com/location/80905/content/4eb86004-c377-4541-a90d-e76bb7463fb5,This content request shows the kind of fun voice it's possible to include for some salons!,Spa and Salon,Spa,Product/Service,https://media.mainstreethub.com/media/1f4597d2-49a6-4f38-8421-957559fd6f5f,Lauren Smola
"Believe it or not, receiving cuts more frequently will give you longer, healthier hair! Show your locks some love by booking your appointment: https://duwaynessalon.com/.",https://passport.mainstreethub.com/location/62193/content/47937474-b0e1-471b-a825-7aa716aac727,A helpful tip that doubles as a CTA to book a hair appointment! The website link is definitely helpful here.,Spa and Salon,Hair Salon,Product/Service,https://media.mainstreethub.com/media/9091413e-a1ab-4fe4-a87a-0685d042c66f,Zoe Labos
"Managing a property is hard work -- especially if you have multiple units. Not everyone has the time, energy, or resources to maximize their potential profits. Thatâ€™s where we come in! Just give us a call to learn more: (310) 373-9382.",https://passport.mainstreethub.com/location/78114/content/948210c4-e5c8-4283-b62e-d2db5f1f0b10,Spot-on customer voice for this unique property management service. Actionable and based on specific needs the reader may have.,Professional Services,Real Estate,Product/Service,https://media.mainstreethub.com/media/38c156dc-4657-49fd-94e8-178565e96bff,Zoe Labos
"It's common to see a spike in FSBO listings during a hot market, but research shows that ""For Sale By Owner"" listings sell more than 25% below market. Agent fees are typically just 6%. Don't gamble with one of your most valuable assets by trying to handle the sale yourself.",https://passport.mainstreethub.com/location/73170/content/06d80888-e702-460e-a9d2-9249c7557b4f,Elevating a popular tip about selling with a real estate agent with a strong sense of customer voice and some extra industry expertise.,Professional Services,Real Estate,Product/Service,https://media.mainstreethub.com/media/a0278361-7d09-4126-a477-a1f222e5a8b3,MIcah Scott
"Located right off of the coast, San Diego is a diverse & laid-back community full of beautiful beaches, exciting nightlife, & tasty food.",https://passport.mainstreethub.com/location/81070/content/164a7803-0dd0-44a8-a008-6f5ebc14e348,Awesome customer voice and specificity when describing the area where this agency operates.,Professional Services,Real Estate,About the Business,https://media.mainstreethub.com/media/2f8a66f8-f356-49bd-8063-7fe07a3e430c,Clare Murray
"Are you on the fence about selling your home? Properties are in high demand right now, but there are not enough options on the market. This makes locating buyers with attractive offers simpler. #sellyourhome #sellingahome #homesforsale",https://passport.mainstreethub.com/location/70548/content/656df697-4061-4942-87ac-b8dcec481c7d,Wordplay helps elevate a straightforward tip. Overall sense of industry expertise.,Professional Services,Real Estate,Educational,https://media.mainstreethub.com/media/c0fc4f9a-192c-4314-82b3-39980ce3546a,Ian Austin-Michaud
Buying your first home is a huge milestone in anyoneâ€™s life! We canâ€™t wait to help you reach that goal. Reach out when youâ€™re ready to kick off the process. #603RedstoneRealty #NHRealEstate #MaineRealEstate #HomeBuyers,https://passport.mainstreethub.com/location/76523/content/f30bf20b-80ff-432e-9368-24ccb765191f,"Straightforward but relevant customer voice, especially with this tricky close-up photo.",Professional Services,Real Estate,Product/Service,https://media.mainstreethub.com/media/2b2753eb-4ab7-48b9-afed-9fb2ca796f26,Alaina Johnson
"When looking for help in selling in this housing market, you don't just need someone with the mind of a REALTORÂ® -- you need a friend with the heart of a nurse! I can't wait to be there to help you get the most for your home with the right staging. #kennesawga #realestate",https://passport.mainstreethub.com/location/78805/content/aa1cf84c-e9bf-4c23-9ae5-99a194f5178a,Addressing something that really makes this REALTOR unique! Awesome attention to customer notes.,Professional Services,Real Estate,About the Business,https://media.mainstreethub.com/media/a512d1ae-1348-4e9c-8006-b0c14a9575f4,Laura Chandler
"Your dog deserves to be happy at home too! From big yards to cozy corners, I'll find everything on your list to ensure that your furry-family member loves your new place as much as you do. To get started, just give me a call at (617) 413-4550. #WestonHomes
",https://passport.mainstreethub.com/location/54990/content/ec02c662-71d4-42bf-b8f0-7b981cdd3ce7,Unique sense of customer voice to enhance a popular tip about finding a home that your pets love.,Professional Services,Real Estate,Product/Service,https://media.mainstreethub.com/media/a13cd6fa-caf5-488b-8fcb-b12fb45474c6,Omar Guzman
"Surrounding schools can play a big role in the value of a property. As an investor, it's important to consider the quality of local districts before closing on a potential rental property!",https://passport.mainstreethub.com/location/71085/content/56b5429e-7b4e-4c2a-9032-d3a577403761,Clearly addressing a unique audience: Property investors. Great way to differentiate this tip!,Professional Services,Real Estate,Educational,https://media.mainstreethub.com/media/f12182c6-ac90-4a77-9ef0-01b498d7d990,Gabrielle Medina
Here's a bright idea! Update your home's light fixtures to add a personal touch and give your space an immediate upgrade.,https://passport.mainstreethub.com/location/72313/content/427c0e40-2bac-4abe-9a13-f3573865290a,Taking inspiration from the photo for a simple but actionable tip that adds variety to this customer's content.,Professional Services,Real Estate,Educational,https://media.mainstreethub.com/media/c04b0e5d-4b28-4d30-a0b3-a70c33d475c3,Alyssa Imig
Ready to expand your business? Contact us today to find the perfect new location. #realpeoplerealdreams #thevossteam #robertavoss #commercialrealestate #arizonarealestate,https://passport.mainstreethub.com/location/61717/content/53b37fd6-b48e-4410-a44d-9421e6571b9f,Clearly addressing a commercial real estate audience!,Professional Services,Real Estate,Product/Service,https://media.mainstreethub.com/media/55c98439-f160-4797-80f9-0067ad630f35,Harmony Rubin
Gardening is more than a fun hobby -- it can also increase your homeâ€™s curb appeal and value! What are you planting this spring? ðŸŒ¼,https://passport.mainstreethub.com/location/78715/content/46cfb260-5da1-4289-a9d3-de89a5ca2341,Timely and relevant tip that can also work with some of the outdoor photos from real estate photo shoots.,Professional Services,Real Estate,Educational,https://media.mainstreethub.com/media/91563fec-1fed-4996-b228-fc2609e1412e,Emily Burke
"Now more than ever, it's important to support local. What are some of your favorite local businesses in Denver?",https://passport.mainstreethub.com/location/62879/content/59e0e7ab-9839-4c2e-bb6e-38f628677436,Tailoring and adding a hook to this question to make it engaging and customer-specific.,Professional Services,Real Estate,Audience Participation,https://media.mainstreethub.com/media/d3580816-f028-4bfb-b08a-e047e420d043,Brandon Kenning
Ready to go compact? We can help with that.,https://passport.mainstreethub.com/location/43944/content/586a8a93-e6cb-40be-bf95-4c9411bc259e,"Tailoring a stretchier concept (""we can help with that"") based on the photo. Simple but creative, and could also work with a link to the customer's website.",Automotive,Auto Sales,Product/Service,https://media.mainstreethub.com/media/d3f63c2b-42ea-49e3-bc7d-a0531116bca4,Jose Rodriguez
"As a local business, we know what our Chickasha community is looking for in a car dealership: a low-pressure sales environment, a friendly team, and high-quality inventory. #ChickashaOK",https://passport.mainstreethub.com/location/79083/content/6e05f713-7981-4a23-b685-ad95850f84ea,"Using the specific local connection to tailor this post. The overall phrasing is also nice and specific to car sales, and reflects the customer's ""sincere/welcoming"" voice.",Automotive,Auto Sales,Product/Service,https://media.mainstreethub.com/media/39912261-403e-4d3b-b706-6b358eb8d7bf,Zoe Labos
"Blue light from our screens can damage your retina -- if youâ€™re working long hours in front of a screen, opt for glasses with blue light lenses to protect your eyes.",https://passport.mainstreethub.com/location/71310/content/395fe066-f895-4f40-9622-a9c031466eac,Helpful information based on a specific consumer need. This doubles as promotion for a higher value item the office sells compared to regular lenses.,Health and Wellness,Optometry,Educational,https://media.mainstreethub.com/media/8e5d4f1e-ed8e-4b4b-8238-28e898309145,Kaitlin Morley
"With our in-depth, focused in-office or virtual appointment, allergy relief has never been easier.",https://passport.mainstreethub.com/location/81105/content/91890f12-80ff-4b5e-8769-90eadfaae24f,This brand kit post is a great example of framing a specialist doctor's services. ,Health and Wellness,Specialists,About the Business,https://media.mainstreethub.com/media/52a146f6-f073-4487-bc32-4a50fa174dde,Clare Murray
Letâ€™s work together to elevate your health and take strides toward a happier self! Appointments are available at (501) 882-2260. #beebephysicaltherapy #physicaltherapy,https://passport.mainstreethub.com/location/59547/content/517c3ab6-1505-414d-a95e-bd12c65aebab,"The caption is nicely tailored to the benefits of physical therapy, and the picture includes only two people. Knowledgeable and positive but not overly excited voice.",Health and Wellness,Physical Therapy,Product/Service,https://media.mainstreethub.com/media/e0d4cdd7-0a82-48da-8c12-3ccf63493627,Laura Chandler
"Due to the minimally-invasive nature of laser liposuction, patients will have a quicker treatment time and experience a faster recovery -- and who doesn't love the sound of that! #RadioFrequencyBodySculpting #UltrasoundBodySculpting #AlmaLasers #SiliconValley #BayAreaMedSpa",https://passport.mainstreethub.com/location/78785/content/462bcb56-f10e-4473-ac21-9c133c80cd10,Awesome level of detail when describing this unique health spa service. The last bit of the caption adds a great sense of customer voice that matches the image.,Health and Wellness,Med Spa,About the Business,https://media.mainstreethub.com/media/6170c73e-8877-463f-b7d6-053ebac47d7e,Jenna Uptigrove
"Escape the hustle and bustle of the city by spending a weekend out in the beautiful Texas Hill Country. In Burnet, fresh air and relaxation are easy to come by. #TexasHillCountry",https://passport.mainstreethub.com/location/41148/content/bedf306e-7fe7-48b1-8cf3-1bbdf49b0f99,A creative and customer-specific hook in the caption and a beautiful photo combine for an ultra effective post. I'm booking my stay.,Hotel,Resort,Product/Service,https://media.mainstreethub.com/media/551293bd-bfaf-47ad-9b16-30dd9e45a6aa,Hallie Colbert
Taking a proactive approach to your dog's dental health will help fight against many common dental health issues -- like plaque and tartar buildup and periodontal disease. Keep your dog's teeth in good condition and let our team tackle the task!,https://passport.mainstreethub.com/location/76512/content/b73ca1dd-e0d3-43dc-b02c-bd8deb406abd,This helpful educational tip takes a turn to promote a specific service the vet offers. Perfect combo!,Pets,Veterinary,Product/Service,https://media.mainstreethub.com/media/680a9fa2-64d2-4f06-ad22-ff05a864b659,Gabrielle Medina
"Treats like bully sticks can be a great substitute for your leather shoes and the legs of the dining room table! Chewing also keeps dogsâ€™ jaws strong, teeth clean, and breath a bit fresher.",https://passport.mainstreethub.com/location/29293/content/e17646c1-c34c-484f-a2f6-f294ab649849,Connecting to a very specific consumer scenario (dog is chewing up shoes) to promote a product. Going the extra mile by describing even more benefits of this type of dog treat!,Pets,Pet Store,Product/Service,https://media.mainstreethub.com/media/5f3d2258-c3cb-4c3f-933f-51168e554311,Annie Cranford
Tell thirst to beat it! We've got everything you need for your next trip.,https://passport.mainstreethub.com/location/40631/content/85006b03-3df8-433c-80b7-85c732621c9c,Straightforward but specific and effective thanks to creative phrasing.,Retail,Outdoors,Product/Service,https://media.mainstreethub.com/media/27867ea0-a994-49d5-b988-1f418c4ddac9,Jose Rodriguez
Looking for a new cocktail to try? Try your hand at making a French 75! The bright lemon flavor is perfect for the spring months.,https://passport.mainstreethub.com/location/47503/content/fc766d4e-512b-4e2a-af52-c8be25ed7a4c,"What better way to get people to make a trip to the liquor store than an easy recipe (that happens to involve two separate products the store sells, if not all four).",Retail,"Beer, Wine, Liquor",Educational,https://media.mainstreethub.com/media/0ec15641-c36d-46ab-a96c-0b0fe7a06d1d,Alaina Johnson
"We do orchestral string repairs! Whether it's a standard service, re-string, bridge replacement, or neck re-set, we're here to offer exceptional service for your instrument.",https://passport.mainstreethub.com/location/44117/content/321309fe-858c-4c9a-a4d0-20bddb80371e,Getting super specific with one aspect of this music shop's services. Expertise and strong connection to what orchestral musicians might need!,Retail,Music store,Product/Service,https://media.mainstreethub.com/media/14a06762-6d22-45e4-9d9e-430214724e38,Alyssa Imig
Why are irrigation systems important? They allow you to control the amount of water that's being fed to your craps so that you can maximize every yield.,https://passport.mainstreethub.com/location/79439/content/62b56d10-a81e-4160-823e-e969db301cb4,Establishing expertise for a pretty niche customer. Succinct but helpful and phrased in a way that doesn't feel overly obvious or too technical.,Retail,Agriculture,Product/Service,https://media.mainstreethub.com/media/7573ee08-b660-4d71-bd0e-dca1a240aaa0,Derek Koh
"Our seasonings are the only thing youâ€™ll need to turn any recipe into a healthy, restaurant-quality meal. #SaltyWahine #HawaiianRub #RestaurantQualityAtHome #MakingEatingHealthyFun #Hanapepe",https://passport.mainstreethub.com/location/41712/content/58e085d6-e4b9-4417-835a-74502197d7dc,Perfect way to describe this customer's unique signature products. Strong appeal to any reader who likes to cook!,Retail,Food,Product/Service,https://media.mainstreethub.com/media/8f8557d1-6893-4f5d-8b39-ce4782770cf2,Emily Carpenter
