caption,passport_link,comment,vertical,subvertical,category,media,author
The elephant symbolizes wisdom and loyalty among other things. This is why Robert will always be loyal to you and share his expertise and knowledge with you through the entire legal process. #LosAngelesAttorney,https://passport.gds.gdcorp.tools/location/58660/content/a940473a-1f20-4ed5-8849-ed3e464c4dfb,"Using a customer photo for inspiration yields an ultra-unique post about this agent! Perfect customer voice. This wouldn't work for pretty much any other agent, but many agents may have similar pictures of personal curios that could inspire similar posts.",Professional Services,Real Estate,About the Business,https://media.mainstreethub.com/media/f69fac2f-cd97-4835-a4ba-f6e1cab6490b,GIllian Golden
"The housing market is rising as fast as the temperatures are! If you've been thinking of selling, now's the time to reach out: (704) 650-6689. #CommitmentBeyondSold #GravesRealtyGroup #NextHomeAllegiance #ConcordNC #ConcordHomes #ConcordRealEstate",https://passport.gds.gdcorp.tools/location/69576/content/f29d4ca4-4f59-4a86-ab1c-01ba2f5e24cd,Timely and actionable! ,Professional Services,Real Estate,Product/Service,https://media.mainstreethub.com/media/3406c513-e07f-4784-9ef8-2fb02267fd2e,Valerie Lancaster
"There are a few things guaranteed to make me smile: cute dogs, beautiful properties, and helping clients find their dream homes. #annalbertrealtor #keyrealty #professionalstaging #toledoohio #toledohome #toledocondo",https://passport.gds.gdcorp.tools/location/71149/content/1cf8c788-70dd-4002-87c0-633d38122dd5,Nice sense of customer voice makes for a purposeful about the business post that still clearly connects to the cute dog photo.,Professional Services,Real Estate,About the Business,https://media.mainstreethub.com/media/73ae5495-b8fd-46ad-be46-d165795d9faa,Brandon Kenning
"One of my passions is cycling, hiking, and exercising to raise awareness for causes I care about. I use that same drive to help my clients.",https://passport.gds.gdcorp.tools/location/81373/content/ce6945c5-cedc-44e7-835a-1585ffbd9624,This brand kit post is a perfect way to showcase some background info about the customer that you'd find in their notes/ID!,Professional Services,Real Estate,About the Business,https://media.mainstreethub.com/media/bb09a319-9425-4239-80fe-409e41f5015d,"""Cron User"""
"Bring your passion for baking to life in a new, large kitchen! Start your search for your dream preparation space today. #ShameanPrice #eXpRealtyOfCalifornia #RealEstate #StevensonRanch #CaliforniaRealEstate #eXp",https://passport.gds.gdcorp.tools/location/61470/content/0c9124fc-792b-4239-b862-d2ea6090d085,Appealing to a clear audience in an actionable way. The language is on point and elevates this beyond a typical post about getting a new kitchen.,Professional Services,Real Estate,Product/Service,https://media.mainstreethub.com/media/00a46e23-5fd1-440a-9112-26acf2f1d443,Emily Tuite
Patterns are a fun and decorative way to make a statement. Let's explore the best ways to use patterns to make a room come alive. Read the article here on our blog. #GotchaCoveredOfEastSideSeattle #InteriorDesign #HomeDesign,https://passport.gds.gdcorp.tools/location/54512/content/1f3f1ac8-8464-4a49-8f31-413671227e62,"The design tip makes a fun hook for the blog post this customer requested us to post about, and it's a good example of the kind of voice that a window treatment customer might bring to an educational post or engagement question.",Home Services,Windows & blinds,Educational,https://media.mainstreethub.com/media/0d8852c3-0e56-4da8-8896-132cf6ea01e3,Katelynn Spaid
"Our Simplicity Method takes inspiration from Marie Kondo in identifying what brings you joy. That way, we can create systems that work for you and help you cut down on constant tidying -- leaving you more time to enjoy your life and space!",https://passport.gds.gdcorp.tools/location/77207/content/c8c9eed0-e67f-4289-b41e-349e91a419be,"Super creative graphic. This is an expert Composer hack, and it takes an otherwise-boring stock photo to a whole new level. The caption is also an amazing use of customer info presented with spot-on sense of voice.",Home Services,Cleaning Services,About the Business,https://media.mainstreethub.com/media/36a9b69a-53fc-4b23-a892-17b8a865760c,Caitlin Smith
"Ramps, trollies, and more: There's a lot of equipment that's required for a seamless move. Let our team take care of it all! #Moving",https://passport.gds.gdcorp.tools/location/68433/content/ad480539-bd33-4a4a-b667-26bdc3cabf9b,"Creative use of photo details and industry knowledge make for a very specific and on-brand caption that goes way beyond referencing ""the team.""",Home Services,Moving,About the Business,https://media.mainstreethub.com/media/c3420b2a-32eb-4caa-b284-2c26eb44a58b,Kaitlin Morley
"Every space is in its perfect place when you build with us! From top to bottom, weâ€™ll help you create a home that maximizes every square foot for leisure, function, storage, livability, and more. #FootittHomes #HomeServices #LuxuryHomes #HomeConstruction #NorthFargo #NorthDakota #NDHomes",https://passport.gds.gdcorp.tools/location/74960/content/04775f69-f824-4549-8349-389f0a178266,"This customer request is an excellent example of the sense of voice to use for a luxury home construction customer. The language is on-brand from start to finish, and the CTA to visit the website is phrased in a very unique way.",Home Services,Construction Engineering,Event/Special/Listing,https://media.mainstreethub.com/media/2ba4720a-b69e-4ab0-8f48-03fbeb1bd455,Sona Bang
"You don't need to remodel your entire home to refresh your space -- one room at a time is just fine. We'd love to know: If you had to choose just one, would you revamp your bathroom or kitchen first?",https://passport.gds.gdcorp.tools/location/62088/content/fbe4420d-5953-4350-a8ba-cd3ac6a2ab3b,"An educational tip makes a nice hook for this engagement question, and it's framed in a way that's very likely to get lots of responses. ",Home Services,Contractors,Audience Participation,https://media.mainstreethub.com/media/604c50ab-ddfa-4e30-9497-fd2e1f016a53,Hallie Colbert
"When you're getting ready to sell your home and want to fix up any issues before putting your home on the market, call Kushner Home Inspection LLC. Steve will provide you with a Sellers Inspection so that you know what issues take priority: (845) 781-3544.",https://passport.gds.gdcorp.tools/location/57155/content/95d0916e-a58b-4588-ae42-69bdfe980543,"The customer's notes mention wanting to address sellers, and this caption is a perfect way to do that! Clearly appealing to their unique consumer needs.",Home Services,Home Inspection,Product/Service,https://media.mainstreethub.com/media/e0583893-3e7e-4281-b7d5-4bd0989c26f8,Maddy Dessanti 
"Whether itâ€™s your kitchen sink, dishwasher, and stovetop or the elevator in your commercial space, you can count on us to bring the very best out of your stainless steel. #CasaVerdeStainlessRefinishing #StainlessSteelAppliances #ApplianceRefinishing #HomeAppliances #ApplianceMaintenance",https://passport.gds.gdcorp.tools/location/79910/content/1f476cdb-a20b-40d5-9369-49742d486e06,"For such a specific service (stainless steel cleaning), it can be tricky to appeal to a range of consumer needs. This caption accomplishes it with ease, potentially setting up a number of even more specific posts about those individual situations where the business can help.",Home Services,Cleaning Services,Product/Service,https://media.mainstreethub.com/media/61851aaa-d5e2-45bf-a92d-ead7307c3451,Peter Vandendriessche
"Being your one-stop shop is our greatest pleasure! We can also help with cabinets, countertops, and all your other surface-remodeling needs.",https://passport.gds.gdcorp.tools/location/66836/content/17f00c64-5697-4ca1-8368-f66d7c2b0715,Perfectly complementary caption for this testimonial quote. It's great how the caption ties in several other services the customer can provide.,Home Services,Contractors,Testimonial/Cross-Promo,https://media.mainstreethub.com/media/76e9f5f2-99a7-45ed-a663-15e46af00c2b,Alyssa Imig
"Rain or shine, The Weather Protection Company is here to help! Learn more about our weather protection services by calling us today: (318) 450-3719.",https://passport.gds.gdcorp.tools/location/65038/content/35b4bc97-b98f-4ff9-853a-90eecdf2f9f0,"On-brand stock choice adds some variety to this customer's content calendar, while the caption clearly promotes the customer's unique range of services for homeowners.",Home Services,Contractors,About the Business,https://media.mainstreethub.com/media/61a07b48-f0a2-4173-9803-4ef5700261f1,Gabrielle Medina
A/C units are in extra high demand this summer! Don't wait until the heat kicks in to get your A/C needs taken care of. Schedule your service with us by giving us a call at (559) 276-7457. Follow the link on our Facebook post to learn more! #californiaindoorcomfort #fresnocalifornia #hvactechnician #liveincomfort #hvacservice,https://passport.gds.gdcorp.tools/location/51312/content/cfc1abdf-a1c9-4e2a-9c88-b0a91923c9b2,"The text on this stock photo helps make it look less stock-y, and the caption plays on a current trend without being overly alarmist. Instead, the reader feels confident and able to take action.",Home Services,HVAC,Product/Service,https://media.mainstreethub.com/media/8d356c12-d551-4a99-a231-5c821e3a64c0,Emily Ferris
"Give us a call and ask about our maintenance, repairs, and customizations for German vehicles! When you need work done, we know the drill. #HardeysMotorWerks #GermanCars #GermanAuto #Audi #VW #AutoRepair #CarExperts",https://passport.gds.gdcorp.tools/location/39503/content/05018e56-04ab-4ca5-a997-4f5f782105eb,Going to the notes for specific customer info that helps increase the relevance of the content calendar overall.,Automotive,Auto repair,Product/Service,https://media.mainstreethub.com/media/54443edf-fae6-4a2e-b7c9-4cc71a096744,Allison Randel
"As fun as your Mustang might be, we'll always treat it with respect here and never like a toy. We'll leave that part up to you when our work is finished!",https://passport.gds.gdcorp.tools/location/40840/content/7abda9bd-24fa-4414-ab01-e847f91fcd04,"Playing on the photo of a toy car in a way that's fun but still relevant, actionable, and fits with the customer's overall voice. ",Automotive,Auto customization,Product/Service,https://media.mainstreethub.com/media/982a39d2-aee1-48bc-97e4-c61dd8d7a6ad,Michael Greeson
"If you do, we're there in an instant. All you have to do is give us a call. We'll get you towed no matter what. (910) 353-7278",https://passport.gds.gdcorp.tools/location/25285/content/fd2b7703-5330-4a94-bfe1-4df132f9579e,"Totally on-brand for a towing customer, and nicely tailored based on this customer image. Really embodying the customer's voice and how they can help. Bringing a bit of levity to a frustrating situation.",Automotive,Towing,Product/Service,https://media.mainstreethub.com/media/2af22f59-4f9a-42db-86f0-c41c2fe76c91,Derek Koh
"One chip can turn into a major headache quickly. For speedy and professional windshield repair, call us at (916) 688-4141 -- we can even come to you! #WindshieldRepair",https://passport.gds.gdcorp.tools/location/71034/content/bac05859-f8f3-4629-808f-162d739e1836,"A friendly, reassuring way to talk about auto glass repairs. Tying in their mobile services is a great touch for customer-specificity and overall impact on the reader!",Automotive,Auto repair,Product/Service,https://media.mainstreethub.com/media/51016624-8c7b-4d15-ad7d-3e5582afc244,Robert Valenzuela
Have a dream of owning a food truck but need a little boost financially? Give us a call to discuss our competitive rates and financing options: (323) 526-0088.,https://passport.gds.gdcorp.tools/location/80095/content/b46fd50b-312e-4b67-b555-d84ede833bac,This is a niche auto customer -- focused on selling food trucks -- and the caption is 100% unique to the business. Great use of customer information to appeal to consumer needs and promote the business's financing options.,Automotive,Auto sales,Product/Service,https://media.mainstreethub.com/media/a0364c0f-921a-4d35-826e-79135ecd5219,Jenna Uptigrove
"Manual lymphatic drainage massages can help decrease recovery time and improve results from cosmetic liposuction, like tummy tucks, Brazilian butt lifts, fat transfers, etc.",https://passport.gds.gdcorp.tools/location/68376/content/964f2432-0e51-40c8-b846-4aa4f1223e4b,Great use of customer knowledge to frame the benefits of their massage services. Clearly meeting consumer needs without going too far into concrete health claims.,Health and Wellness,Massage therapy,Educational,https://media.mainstreethub.com/media/36155a92-34a1-4d70-83ff-bc72bf7a6e63,Isa Jones
"Pregnancy changes a woman's body, and those changes can lead to bodily imbalances and pain in the lower back, shoulder, neck, and static nerve. Our specific prenatal spinal adjustments help reestablish balance and alignment in the spine.",https://passport.gds.gdcorp.tools/location/50441/content/5d55987e-a4ab-44df-96ee-8f27716f9c5e,"Awesome level of customer knowledge to frame the benefits of these massage options for a specific audience, people who are pregnant.",Health and Wellness,Holistic,Product/Service,https://media.mainstreethub.com/media/4a64abba-9a37-499e-86f2-8e8538148ea6,Esther Seawell
"Designed to mimic your natural teeth in feel, appearance, and function, dental implants make for excellent, long-lasting solutions. Weâ€™d be happy to discuss our implant procedure and process with you at your next appointment. #FrankCelenzaDDS #DentistsofInstagram #DentistsofNewYork #CosmeticDentistry #GeneralDentistry",https://passport.gds.gdcorp.tools/location/76646/content/b3227fa6-9dae-49d5-b04d-4ca949236ea6,"This customer's notes mention implants, so this post is a great way to give followers more information about exactly what an implant involves!",Health and Wellness,Periodontist,Educational,https://media.mainstreethub.com/media/ecf0de04-834a-4974-9ec3-e6ce60d2c9d0,Lacey Morris
"Did you know? Fine lines, wrinkles, and other common signs of aging tend to begin around 25. It's almost never too early to seek treatment, look younger, healthier, and feel your best! Call to ask us about our services: (845) 393-1120. #SkinCare",https://passport.gds.gdcorp.tools/location/81199/content/6cd30ad9-4838-423a-a6b8-933178d52c80,Targeting a younger audience and presenting the benefits of this customer's treatments in a clear way that doesn't include unnecessary claims or guarantees.,Health and Wellness,Med Spa,Product/Service,https://media.mainstreethub.com/media/5ef12756-bafc-4ecc-b623-de74f2bfcf46,Alyssa Wright
"Did you know? Our cabins were hand-built in 1984. We've made renovations since then, but they have been here for countless families looking for a relaxing getaway. Do you remember your first visit to North Yellowstone? #NorthYellowstoneCabins #Yellowstone #NationalPark #Gardiner",https://passport.gds.gdcorp.tools/location/72357/content/385385b9-3b6d-4878-992c-5c95c56311f4,Pairing a great bit of customer info with a fun participation question. The result is totally customer-specific and very engaging for readers!,Hotel,Cabins,Audience Participation,https://media.mainstreethub.com/media/0bd707b3-4a7b-43a9-ac4e-8871df5f5ac1,Amanda Aguirre
"We're proud to offer amenities for our guests such as high-speed internet, oversized bathrooms, and a breakfast bar. Experience true luxury during your next trip here at The Hotel Concord.",https://passport.gds.gdcorp.tools/location/55562/content/3b8fda87-eb26-4aa7-b832-7577d87e3d51,Really embodying the customer's upscale voice and highlighting several specific amenities that set them apart!,Hotel,Hotel,Product/Service,https://media.mainstreethub.com/media/5394a93e-b074-44e1-8c35-e44b28135c9e,Alyssa Imig
"You wouldn't want to be stuck at home alone all day, and neither would your pup! Whether you're away for work or play, our boarding program will ensure that they get the exercise and socialization they need while you're gone. #SanJoseCA #DogDayCare #boarding",https://passport.gds.gdcorp.tools/location/77994/content/3434318a-fe73-4534-8669-cb69c9954989,"Framing pet boarding services in a fun, positive, helpful way that avoids negative associations that concept might bring up.",Pets,Pet daycare,Product/Service,https://media.mainstreethub.com/media/43c12e61-4bdf-40b5-8852-aec231341ff2,Annie Cranford
Let's take care of those bulky items this week -- bring your comforters and sheets! #Washateria #UpscaleLaundromat #WashAndFoldService,https://passport.gds.gdcorp.tools/location/60054/content/00ccdbb2-34ce-4ace-95c7-4a48399068a9,Basing this post on a unique consumer need makes it engaging and adds great variety to the content calendar.,Retail,Laundromat,Product/Service,https://media.mainstreethub.com/media/778516bf-95b7-4e39-aefc-93f8d7404742,Noah Ainsworth
"Some jewelry is trendy, some is timeless. Either way, we'll work with you to make sure it's exactly what you want. #ZeidmansJewelryAndLoan #DetroitJewelry",https://passport.gds.gdcorp.tools/location/26717/content/3bf90305-4e3a-4209-84f0-24cf46b3e867,"Matching this customer's sophisticated voice and promoting that they offer new jewelry, which is mentioned in the notes.",Retail,Jewelry,Product/Service,https://media.mainstreethub.com/media/d6321cba-4b2d-4de2-ba26-cf03418fa61b,Megan Martinez
Nothing should keep you from getting the most out of your workout -- especially joint pain. #VictoryHomeMedicalSupplies #SportsInjurySupport #MedicalSupplies,https://passport.gds.gdcorp.tools/location/37239/content/916e6cd8-ec32-47cd-a711-15e039685ca3,"An eye-catching and cohesive graphic elevates a succinct but very specific caption. Perfect combo, and totally unique to this customer.",Retail,Medical supplies,Product/Service,https://media.mainstreethub.com/media/02ab8210-84c9-4eeb-b8a1-c8ebbfc30649,Andrew Broadous
Your setup isn't complete without the perfect pillow and sheets! We'll help you find products that pair well with your new mattress.,https://passport.gds.gdcorp.tools/location/41008/content/3a0c1ee1-afa3-40b9-84a0-547a1ee82ca2,"Clear but not overly pushy, and framing shopping for pillows/sheets as a fun activity after buying a mattress. Actionable and on-brand!",Retail,Furniture,Product/Service,https://media.mainstreethub.com/media/14248f9f-98b9-42c2-bea1-2efe5e47564a,Zoe Labos
Large format printing requires highly specialized equipment and expertise. Postal Plus has both the state-of-the-art equipment and the training necessary to produce large prints on a variety of media. #PostalPlus #OFallonMO #PostalService #PostalStore,https://passport.gds.gdcorp.tools/location/79627/content/1574b4ca-1883-40b2-98ab-739550d570af,"Talking about equipment and expertise can feel flat or overly stretchy, but this caption is perfectly tailored with additional customer info to warrant those benefits. Awesome level of detail and customer voice.",Retail,Postal store,About the Business,https://media.mainstreethub.com/media/abc8fb9f-060e-4375-a61f-11f569fcf27e,Alaina Johnson
"Umami -- it's not a made-up word! It's one of the five staple tastes along with sweet, sour, bitter, and salty. Though it's hard to put into words, you'll understand when you take a bite of your fajita nachos. ðŸ¤¤ #DosRiosMexicanGrill",https://passport.gds.gdcorp.tools/location/41374/content/8e1a1d35-ddc4-4980-9a3e-9bff02c928cc,"Stretchy concept that's nicely tailored based on a specific dish served at this restaurant. While the caption won't be appropriate for every restaurant, it fits with this one's ""fun, excited"" voice.",Restaurant,Mexican,Product/Service,https://media.mainstreethub.com/media/54f523d9-f107-4de3-b055-ca5dcf7d923f,Emily Holton
"Bacon, guacamole, pepper jack cheese, lettuce, tomato, and a side of sweet potato fries. Are you drooling yet?",https://passport.gds.gdcorp.tools/location/40098/content/565c056f-71c1-4ec2-8232-450c9da0d062,"A perfect example of creatively describing a photo to craft a specific, engaging caption without having to dig into the customer's menu.",Restaurant,Burgers,Product/Service,https://media.mainstreethub.com/media/c0d5e874-b995-4d0c-b3e3-caace6886090,Isa Jones
"A tan may not give you instant abs, but our airbrush tans do have a slimming effect. Bronze your way to confidence! #BestSprayTanSanJose #glow #bronzed #NoTanLines #TanMeSkinny",https://passport.gds.gdcorp.tools/location/80776/content/d118a942-574e-49eb-b863-8d65ede5271c,"Highlighting a benefit of spray-on tans in a positive, empowering way.",Spas and Salons,Tanning salon,Product/Service,https://media.mainstreethub.com/media/5d9c57ed-cce9-453b-bb61-ef255842348b,Alaina Johnson
"We handle all repairs and specialize in Mercedes, BMW, Volkswagen, and Audi. Bring your vehicle by when you need a hand. #GermanMotors #Cotati #Mercedes #BMW #Volkswagon #Audi",https://passport.gds.gdcorp.tools/location/30879/content/de9bc469-df89-44eb-bdd7-d59a135d9913,Expanding on the customer's focus as described in their notes. It's great how this caption uses that info to tailor a stretchier underlying concept (providing a range of auto repair services).,Automotive,Auto Repair,Product/Service,https://media.mainstreethub.com/media/fdecb8b6-d361-47fb-b4e5-9ba07e4b2924,Allison Randel
"I enjoy trying different things, and this has been a game-changer in the kitchen. Who knows what this cooking technique is called and why you might want to try it? Let me know in the comments!",https://passport.gds.gdcorp.tools/location/76143/content/2d3b7e69-fd95-4aa4-b324-fa02e3d98740,This content request is a great example of the type of voice a health and wellness customer (like a fitness instructor or nutrition coach) would like to see in a caption. The question added on the end is also a great touch to make the post that much more engaging!,Health and Wellness,Wellness coach,Audience Participation,https://media.mainstreethub.com/media/2ea03006-e13d-438a-b260-00e74cc3a100,Lou Ruiz
Regular exercise is a great way to help your body feel its best. Join us for a class today and see how you like it! Who knows? Boxing might become your new regular workout. #fitspo #fit #fitness #fitnessmotivation #health #nutrition #1COR619Fit,https://passport.gds.gdcorp.tools/location/68234/content/d2370a46-62c4-43a2-9e51-2a98b4cf9032,Taking inspiration from the specific activity shown in the picture to tailor this caption concept that might apply to a number of fitness and wellness customers.,Health and Wellness,Gym,Product/Service,https://media.mainstreethub.com/media/d1053681-f366-47f9-bd2f-573fe77208ff,Hallie Colbert
"The summer sun isn't the only bright thing around here. To ensure that you head into the season with your most brilliant smile, give us a call at (203) 365-0015 to make your next teeth-whitening appointment. #TiberiFamilyDentistry #BridgeportDental #TeethWhitening",https://passport.gds.gdcorp.tools/location/57141/content/a373e91a-7ce3-4dea-97ea-80d0da201b84,"Awesome, unconventional use of a seasonal connection to promote a high-value service this dentist offers. ",Health and Wellness,Dentist,Product/Service,https://media.mainstreethub.com/media/330634b9-f956-4960-b65d-265b80952d8c,Andrew Broadous
"The best summer evenings are spent here relaxing in a bubble bath. If you could use some R&R, book a stay with us! #RomanticGetaways #TheBentley #BentleyNewJersey",https://passport.gds.gdcorp.tools/location/19048/content/06961db6-96d3-467d-9f16-8bd4c2874778,"A nice example of tailoring a seasonally relevant and stretchable caption concept (""the best summer evenings are spent ..."") based on a unique customer photo. The result feels totally specific to this customer.",Hotel,Hotel,Product/Service,https://media.mainstreethub.com/media/a345fa9a-a616-4767-86a7-7bbf736421a0,Alaina Johnson
Looking for a unique date? Something tell us your significant other would love to spend a day enjoying these fuzzy faces with you! #SabambaAlpaca,https://passport.gds.gdcorp.tools/location/45773/content/be21f37b-51af-4aaa-9aa8-0b3f22a55c6d,Addressing a specific scenario where readers might want to book a stay at this unique bed and breakfast/ranch. Nice sense of customer voice and connection to the cute photo!,Hotel,Ranch,Product/Service,https://media.mainstreethub.com/media/b4cede46-6e85-4dee-8e3c-efb8bef98544,Harmony Rulon
"No matter how long it's been since their last haircut, we'll make sure they leave looking their best. #RebelPet",https://passport.gds.gdcorp.tools/location/80521/content/114549f1-f6a3-410c-b1cb-5ed89c7e6ba0,"Hard to imagine a more on-brand visual for ""Rebel Pet Badass Dog Grooming."" That makes the post feel quite customer-specific, though the caption could also be tailored with a bit of customer detail or unique phrasing!",Pets,Pet Grooming,Product/Service,https://media.mainstreethub.com/media/8d73f9d0-c6c1-4783-a28c-c4bc965d42f6,Gabrielle Medina
"Vaccines help pets live longer, healthier lives. Protecting your pet is our primary goal, so we'll help you determine an appropriate vaccine schedule. Call us today to discuss your petâ€™s vaccination needs!",https://passport.gds.gdcorp.tools/location/50167/content/f642a94a-0b15-4425-8d5f-e18dbbb7270c,Going beyond the general concept of caring for pets to promote a specific benefit to working with a vet you can trust: Ongoing attention to the vaccines your pet needs!,Pets,Veterinarian,Product/Service,https://media.mainstreethub.com/media/c246e107-4bc9-4c97-8a67-039582da4c03,Harmony Rulon
